{
    "number": 2,
    "name": "Experimental Sheet V2",
    "description": "Sheet to be bundled in lesson format",
    "uid": "a94acccf-a5d8-43ae-8cfb-e912d2bd2567",
    "questions": [
        "Hydraulic Scale",
        "Viscometer",
        "Drag on a Plate",
        "Small gravitational waves in shallow waters"
    ]
}