{
    "number": 2,
    "name": "Experimental Sheet V2",
    "description": "Sheet to be bundled in lesson format",
    "uid": "b69cd704-444a-480f-ad4a-ff1de9a48eb1",
    "questions": [
        "Hydraulic Scale",
        "Viscometer",
        "Drag on a Plate",
        "Small gravitational waves in shallow waters",
        "Test"
    ]
}